{
  "$schema": "https://json-schema.org/draft/2020-12/schema",
  "$id": "https://landslide-monitoring/schemas/envelope.schema.json",
  "title": "Sensor message envelope",
  "description": "Envelope of a parsed sensor message published to RabbitMQ. The payload structure depends on sensor_type and is validated against the corresponding payload-*.schema.json.",
  "type": "object",
  "required": [
    "schema_version",
    "message_id",
    "project_id",
    "sensor_id",
    "sensor_type",
    "timestamp",
    "received_at",
    "sampling_interval_seconds",
    "payload"
  ],
  "additionalProperties": false,
  "properties": {
    "schema_version": {
      "type": "string",
      "pattern": "^\\d+\\.\\d+$",
      "description": "Semver of the contract. Currently 1.0.",
      "examples": ["1.0"]
    },
    "message_id": {
      "type": "string",
      "format": "uuid",
      "description": "UUID v4 used for idempotent deduplication."
    },
    "project_id": {
      "type": "string",
      "pattern": "^[a-z][a-z0-9_]{2,49}$",
      "description": "Project identifier in snake_case. Examples: shangtan, lingzhan."
    },
    "sensor_id": {
      "type": "string",
      "minLength": 1,
      "maxLength": 64,
      "description": "Sensor identifier following the paper's convention (e.g. GXZM-DB03, LZ-01)."
    },
    "sensor_type": {
      "type": "string",
      "enum": [
        "gnss",
        "rainfall",
        "strain",
        "soil_pressure",
        "deep_displacement"
      ],
      "description": "Discriminator for the payload structure."
    },
    "timestamp": {
      "type": "string",
      "format": "date-time",
      "description": "When the sensor took the reading. ISO 8601 in UTC."
    },
    "received_at": {
      "type": "string",
      "format": "date-time",
      "description": "When Data Receiving received the raw packet. ISO 8601 in UTC."
    },
    "sampling_interval_seconds": {
      "type": "integer",
      "minimum": 1,
      "maximum": 86400,
      "description": "Sampling interval at the moment of the reading. 3600 by default; lower in accelerated conditions."
    },
    "payload": {
      "type": "object",
      "description": "Sensor-type-specific payload. Validate against payload-<type>.schema.json."
    }
  }
}
