{
  "schema_version": "1.0",
  "message_id": "f47ac10b-58cc-4372-a567-0e02b2c3d479",
  "project_id": "shangtan",
  "sensor_id": "GXZM-SG02",
  "sensor_type": "strain",
  "timestamp": "2026-05-02T14:00:00Z",
  "received_at": "2026-05-02T14:00:05Z",
  "sampling_interval_seconds": 3600,
  "payload": {
    "strain_microstrain": 234.5,
    "temperature_celsius": 24.3
  }
}
