{
  "schema_version": "1.0",
  "message_id": "550e8400-e29b-41d4-a716-446655440000",
  "project_id": "shangtan",
  "sensor_id": "GXZM-DB03",
  "sensor_type": "gnss",
  "timestamp": "2026-05-02T14:30:00Z",
  "received_at": "2026-05-02T14:30:12Z",
  "sampling_interval_seconds": 3600,
  "payload": {
    "displacement_x_mm": 12.34,
    "displacement_y_mm": -5.67,
    "displacement_z_mm": 2.10,
    "displacement_horizontal_mm": 13.57,
    "cumulative_displacement_mm": 1247.5,
    "fix_quality": "rtk_fixed"
  }
}
